{
  "$schema": "https://json-schema.org/draft/2020-12/schema",
  "$id": "https://schemas.kanna.build/workflow.schema.json",
  "title": "Kanna Workflow Definition",
  "description": "Schema for .kanna/workflows/*.json workflow definitions.",
  "type": "object",
  "additionalProperties": false,
  "required": [
    "name",
    "stages"
  ],
  "$defs": {
    "agentProvider": {
      "enum": [
        "claude",
        "copilot",
        "codex",
        "opencode",
        "antigravity"
      ]
    },
    "agentProviderSpec": {
      "description": "A compact provider selector: provider[-model[-effort]]. A plain provider id (see agentProvider) inherits the CLI's own model and effort; an optional model rides after the provider (passed to the CLI verbatim, so multi-segment ids like gpt-5.6-sol work); a trailing effort token (lo/low, med/medium, hi/high, xhi/xhigh, max) sets the reasoning effort. Examples: claude, codex-gpt-5.6-sol, claude-fable-hi, codex-gpt-6-astra-lo, opencode-local/qwen3-coder:30b. OpenCode native provider/model ids may include slashes and model tags. A model is rejected for providers without a model flag, and effort is checked against the provider's published vocabulary when one exists.",
      "type": "string",
      "pattern": "^((claude|copilot|codex|opencode|antigravity)(-[A-Za-z0-9][A-Za-z0-9._-]*)?|opencode-[A-Za-z0-9][A-Za-z0-9._-]*/[A-Za-z0-9][A-Za-z0-9._/:@-]*)$"
    },
    "agentProviderSelection": {
      "oneOf": [
        {
          "$ref": "#/$defs/agentSelectionEntry"
        },
        {
          "type": "array",
          "items": {
            "$ref": "#/$defs/agentSelectionEntry"
          },
          "minItems": 1
        }
      ]
    },
    "agentCandidate": {
      "type": "object",
      "additionalProperties": false,
      "required": [
        "harness"
      ],
      "properties": {
        "harness": {
          "$ref": "#/$defs/agentProvider"
        },
        "model": {
          "type": "string",
          "minLength": 1,
          "description": "Opaque native model ID. OpenCode uses backend/model; suffixes are literal."
        },
        "effort": {
          "type": "string",
          "minLength": 1,
          "description": "Exact native effort or variant; no compact aliases are expanded."
        }
      }
    },
    "agentSelectionEntry": {
      "oneOf": [
        {
          "$ref": "#/$defs/agentProviderSpec"
        },
        {
          "$ref": "#/$defs/agentCandidate"
        }
      ]
    }
  },
  "properties": {
    "$schema": {
      "type": "string",
      "format": "uri"
    },
    "name": {
      "type": "string",
      "minLength": 1
    },
    "description": {
      "type": "string"
    },
    "visibility": {
      "description": "Whether this workflow is offered as a choice. \"internal\" keeps the name out of every listing (the repo manifest, the desktop's new-task picker, the tool catalog's advertised lineup) while it still resolves when named explicitly on task creation \u2014 visibility governs listing, not access. Defaults to \"public\" when absent.",
      "enum": [
        "public",
        "internal"
      ]
    },
    "routing": {
      "description": "How a stage's result chooses where the task goes. Omitted means \"legacy\": success follows the stage's transition policy and a review names a target stage through kanna_request_revision under the task-wide revision_limit. \"exits\" opts into named exits (spec \u00a75): every stage has an implicit `advance` exit to the next stage, a stage may declare loop exits mapped to earlier stages, a session names one of its stage's exits in its result (never a stage), and each loop spends the destination stage's own budget. A workflow that uses exits, budget or loop_transition must declare \"exits\"; one that declares \"exits\" may not use revision_limit, revision_transition or plan_context.",
      "enum": [
        "legacy",
        "exits"
      ]
    },
    "budget": {
      "description": "Routing \"exits\" only: the default budget of every stage that declares none -- how many agent-chosen loop exits may move the task back into that stage before a further one records its result and parks the task instead. Defaults to 5. 0 means agent loops into the stage always park. A person or manager sending the task back to a stage resets that stage's count.",
      "type": "integer",
      "minimum": 0
    },
    "plan_context": {
      "description": "Planning context Kanna stamps onto a task's pinned workflow when a plan stage publishes the remaining stages through kanna_complete_stage. It is written by the server, never authored by hand: an edit that changes it is refused, and an edit that omits it carries the stamped value forward. Its `result` is bound to the reserved $PLAN_RESULT prompt variable for every stage and post of the extended workflow, so the approved plan stays reachable after later stages, revisions, resume, and recovery.",
      "type": "object",
      "additionalProperties": false,
      "required": [
        "source_run_id",
        "stage",
        "result"
      ],
      "properties": {
        "source_run_id": {
          "description": "Stage run whose successful completion published this plan.",
          "type": "string",
          "minLength": 1
        },
        "stage": {
          "description": "Name of the stage that published the plan.",
          "type": "string",
          "minLength": 1
        },
        "result": {
          "description": "The full recorded stage result of that run, in the same shape $PREV_MAIN_RESULT carries.",
          "type": "string"
        },
        "request_digest": {
          "description": "Fingerprint of the exact combined completion that published these stages: the recorded result together with the expected and requested definitions. A retry that matches it is the same operation replayed; one that differs is a different publication and is refused rather than silently ignored or applied over the stored one.",
          "type": "string"
        }
      }
    },
    "revision_limit": {
      "description": "Legacy routing: agent-requested revision rounds a task may spend before Kanna stops forking revisions and parks the task for its human. Defaults to 5 when omitted; 0 disables the cap. A human-requested revision is never refused and resets the count. Routing \"exits\" budgets each destination stage instead (budget).",
      "type": "integer",
      "minimum": 0
    },
    "environments": {
      "type": "object",
      "additionalProperties": {
        "type": "object",
        "additionalProperties": false,
        "properties": {
          "setup": {
            "type": "array",
            "items": {
              "type": "string"
            }
          },
          "teardown": {
            "type": "array",
            "items": {
              "type": "string"
            }
          }
        }
      }
    },
    "stages": {
      "type": "array",
      "minItems": 1,
      "items": {
        "type": "object",
        "additionalProperties": false,
        "required": [
          "name",
          "policy"
        ],
        "properties": {
          "name": {
            "type": "string",
            "minLength": 1
          },
          "description": {
            "type": "string"
          },
          "agent": {
            "type": "string",
            "description": "The role (agent definition) whose session runs this stage. Under routing \"exits\" a stage may omit it: a stage with no role runs its setup when entered, parks without an agent until a person or manager advances it (the advance may carry the gate's summary and artifacts, recorded as the stage's result with the operator's provenance), and runs its teardown when left. Such a stage must be manual, cannot be the first stage, declares no exits, exit_commit, post, prompt or agent_provider, and no loop may lead into it. A legacy stage without agent runs the default agent."
          },
          "prompt": {
            "type": "string"
          },
          "agent_provider": {
            "$ref": "#/$defs/agentProviderSelection"
          },
          "environment": {
            "type": "string"
          },
          "exits": {
            "description": "Routing \"exits\" only: loop exits this stage's session may name in its result, each mapped to this stage or an earlier one, e.g. {\"revise\": \"in progress\", \"replan\": \"plan\"}. `advance` is implicit (the next stage) and cannot be declared. A loop exit taken with status success moves the task back to its destination, carries the result message there, and spends one unit of the destination's budget; any other status parks the task whatever exit is named.",
            "type": "object",
            "propertyNames": {
              "pattern": "^[a-z][a-z0-9_-]*$",
              "not": {
                "const": "advance"
              }
            },
            "additionalProperties": {
              "type": "string",
              "minLength": 1
            }
          },
          "budget": {
            "description": "Routing \"exits\" only: agent-chosen loops back into this stage the task may take before a further one parks it. Overrides the workflow's budget (default 5); 0 means every agent loop into this stage parks. A person or manager sending the task back here resets the count.",
            "type": "integer",
            "minimum": 0
          },
          "policy": {
            "type": "object",
            "additionalProperties": false,
            "required": [
              "transition"
            ],
            "properties": {
              "transition": {
                "enum": [
                  "manual",
                  "auto"
                ]
              },
              "revision_transition": {
                "description": "Legacy routing: completion policy for main runs entered through a revision request. Defaults to transition when omitted. Routing \"exits\" uses loop_transition instead.",
                "enum": [
                  "manual",
                  "auto"
                ]
              },
              "loop_transition": {
                "description": "Routing \"exits\" only: how the task leaves this stage through its advance exit when the stage was re-entered by a loop. Defaults to transition. Independent of the stage's budget and of its first-entry transition.",
                "enum": [
                  "manual",
                  "auto"
                ]
              },
              "handoff": {
                "description": "Routing \"exits\" only, on the final stage only: as the task leaves that stage and closes, Kanna hands the task's pull request to the repository's merge master, delivering the same request a legacy approve post sends. The close waits for the delivery; a task with no recorded PR, or a delivery the merge master cannot take, parks at the stage instead of closing. \"merge\" is the only receiver.",
                "enum": [
                  "merge"
                ]
              }
            }
          },
          "post": {
            "type": "object",
            "description": "Tail work injected into the stage's running agent session when the stage transitions forward. `agent` is the fallback spawned when the session is dead.",
            "additionalProperties": false,
            "required": [
              "name",
              "prompt"
            ],
            "properties": {
              "name": {
                "type": "string",
                "minLength": 1
              },
              "description": {
                "type": "string"
              },
              "agent": {
                "type": "string"
              },
              "prompt": {
                "type": "string"
              },
              "agent_provider": {
                "$ref": "#/$defs/agentProviderSelection"
              }
            }
          },
          "exit_commit": {
            "description": "Routing \"exits\" only: the stage's forward transition starts with a commit step (spec \u00a75). When the transition is requested (a manual advance, or an auto one after a success result), the stage's live session is told to commit its work and record its result; if the session is dead, a short commit session runs in the same workspace. The transition fires on that result, and the next stage forks from the commit it recorded. A failed commit result parks the task with no transition; advancing again requests a new commit step. A commit result cannot name another exit. Cannot be combined with post.",
            "type": "boolean"
          },
          "design": {
            "description": "Routing \"exits\" only: this stage is an App Design session (docs/specs/app-design.md). A person and the stage's one live agent session move freely between the listed positions (static mockup, interactive mockup, prototype, ...) inside this single stage: choosing a position is recorded design state, never a stage transition, so it forks no workspace, starts no session, runs no reviewer and spends no budget. The stage keeps a live document with comment threads whose feedback is queued to the session as it becomes free. It leaves only through Approve for build: the person approves an exact snapshot, the stage's commit step commits the results the repository's design hand-off policy retains, and the next stage forks from that commit. Requires an agent, a manual transition and exit_commit.",
            "type": "object",
            "additionalProperties": false,
            "required": [
              "positions"
            ],
            "properties": {
              "positions": {
                "description": "The design positions, in order. The first is where a new design session starts.",
                "type": "array",
                "minItems": 1,
                "items": {
                  "type": "object",
                  "additionalProperties": false,
                  "required": [
                    "name",
                    "label"
                  ],
                  "properties": {
                    "name": {
                      "type": "string",
                      "minLength": 1,
                      "pattern": "^[a-z][a-z0-9-]*$"
                    },
                    "label": {
                      "type": "string",
                      "minLength": 1
                    },
                    "artifact": {
                      "description": "What the position shows: \"document\", the live design document with its feedback feed, or \"mockup\", the HTML mockup the agent publishes for it, with comments pinned on its elements.",
                      "enum": [
                        "document",
                        "mockup"
                      ]
                    }
                  }
                }
              }
            }
          },
          "setup": {
            "description": "Routing \"exits\" only: commands run in the stage's workspace when the stage is entered, after its environment's setup. For a stage with no role they are the stage's work (mail the reviewers, open the window); if the server stops while they run, restart parks the task at the stage with their outcome reported unknown and never runs them again.",
            "type": "array",
            "items": {
              "type": "string",
              "minLength": 1
            }
          },
          "teardown": {
            "description": "Routing \"exits\" only: commands run in the stage's workspace when the task leaves it, after its environment's teardown.",
            "type": "array",
            "items": {
              "type": "string",
              "minLength": 1
            }
          }
        }
      }
    }
  },
  "examples": [
    {
      "$schema": "./schema.json",
      "name": "default",
      "description": "Standard in progress (commit as post) -> PR flow",
      "stages": [
        {
          "name": "in progress",
          "agent": "implement",
          "prompt": "$TASK_PROMPT",
          "policy": {
            "transition": "manual",
            "revision_transition": "auto"
          },
          "post": {
            "name": "commit",
            "agent": "commit",
            "prompt": "Commit the relevant work for this task. Original task: $TASK_PROMPT"
          }
        },
        {
          "name": "pr",
          "agent": "pr",
          "prompt": "Create a PR for the work on branch $BRANCH. Previous result: $PREV_RESULT",
          "policy": {
            "transition": "manual"
          }
        }
      ]
    },
    {
      "$schema": "./schema.json",
      "name": "orchestrated-child",
      "description": "A workflow an orchestrating agent binds for the child tasks it creates; internal keeps it out of the new-task picker while it still resolves by name",
      "visibility": "internal",
      "stages": [
        {
          "name": "review",
          "prompt": "$TASK_PROMPT",
          "policy": {
            "transition": "manual"
          }
        }
      ]
    },
    {
      "$schema": "./schema.json",
      "name": "shaped-exits",
      "description": "Implement, review with named exits, then PR; the reviewer chooses revise or replan and never names a stage",
      "routing": "exits",
      "budget": 5,
      "stages": [
        {
          "name": "plan",
          "agent": "plan",
          "prompt": "$TASK_PROMPT",
          "policy": {
            "transition": "manual"
          }
        },
        {
          "name": "in progress",
          "agent": "implement",
          "prompt": "$TASK_PROMPT",
          "policy": {
            "transition": "auto",
            "loop_transition": "auto"
          },
          "exit_commit": true
        },
        {
          "name": "review",
          "agent": "review",
          "prompt": "Review branch $BRANCH against base $BASE_REF.",
          "policy": {
            "transition": "auto"
          },
          "exits": {
            "revise": "in progress",
            "replan": "plan"
          }
        },
        {
          "name": "pr",
          "agent": "pr",
          "prompt": "Create a PR for the reviewed work on branch $BRANCH.",
          "policy": {
            "transition": "manual"
          }
        }
      ]
    }
  ]
}
