{
  "$schema": "./schema.json",
  "name": "specialized-reviewers",
  "description": "Use when a single change genuinely spans several specialty domains at once — security, migrations, concurrency, release — each needing its own dedicated reviewer rather than one generalist's best effort. Implement -> dispatched specialty review panel -> PR. Line count is not the trigger: most work, even large work, is better served by single-reviewer's one reviewer; reach for this only when the domains actually named are plural.",
  "routing": "exits",
  "stages": [
    {
      "name": "in progress",
      "description": "Agent implements the task; the transition commits its work",
      "agent": "implement",
      "prompt": "$TASK_PROMPT",
      "policy": { "transition": "manual", "loop_transition": "auto" },
      "exit_commit": true
    },
    {
      "name": "review",
      "description": "Dispatcher selects the specialty reviews this branch needs, fans them out as a joined panel of subtasks, and aggregates their verdicts",
      "agent": "qa-dispatcher",
      "prompt": "Dispatch the specialty reviews needed for branch $BRANCH against base $BASE_REF, then aggregate their verdicts into one review decision. On a later round, review only what changed since the previous review round, carrying forward each untouched specialty's last recorded verdict. Original task: $TASK_PROMPT.",
      "policy": { "transition": "auto" },
      "exits": { "revise": "in progress" }
    },
    {
      "name": "pr",
      "description": "Agent creates a GitHub PR after the specialty panel passes and hands off to the merge master",
      "agent": "pr",
      "prompt": "Create a PR for the reviewed work on branch $BRANCH.",
      "policy": { "transition": "manual", "handoff": "merge" }
    }
  ]
}
