{
  "$schema": "./schema.json",
  "name": "architect-research",
  "description": "Bounded, on-demand architecture research attached to the durable work item being assessed",
  "visibility": "internal",
  "stages": [
    {
      "name": "research",
      "description": "Architect independently verifies the premise, evaluates approaches, and records one advisory verdict for the invoking manager",
      "agent": "architect",
      "prompt": "$TASK_PROMPT",
      "policy": { "transition": "manual" }
    }
  ]
}
