{
  "$schema": "./schema.json",
  "name": "planned",
  "description": "Use when the outcome is already decided and what remains is deciding how to deliver it. Plan (manual gate) -> implement -> review, which chooses by the nature of its findings whether to send the branch back for revision or the approach itself back to plan -> PR, with a human reading the review verdict before it opens. If the product direction itself is still open, route to research first. Skip the plan gate when the shape is already obvious enough to just build (shaped).",
  "routing": "exits",
  "stages": [
    {
      "name": "plan",
      "description": "Planning agent studies the task and records the implementation plan; the human reviews it before advancing",
      "agent": "plan",
      "prompt": "$TASK_PROMPT\n\nWhen you record this plan's result, also publish the remaining stages it chose: on the same kanna_complete_stage call, pass `expected_definition` (the workflowDefinition you read, e.g. via kanna_get_task) and `workflow_definition` (that same document with the stages after plan — \"in progress\", \"review\" and \"pr\" — set to what this plan actually calls for) so the task's remaining plan is formally replaced through the T1 remaining-plan replacement contract, and confirm `workflowExtended: true` in the response. This applies on the workflow's first entry and, if the review stage's \"replan\" exit sends you back here with a revised plan, on that revised-plan visit too — replan returns here precisely so the remaining stages get republished against the new plan.",
      "policy": { "transition": "manual" }
    },
    {
      "name": "in progress",
      "description": "Agent implements the approved plan; the transition commits its work",
      "agent": "implement",
      "prompt": "$TASK_PROMPT",
      "policy": { "transition": "auto", "loop_transition": "auto" },
      "exit_commit": true
    },
    {
      "name": "review",
      "description": "Review agent checks quality and coverage, choosing the revision target by the nature of the findings, before the human reads the verdict",
      "agent": "review",
      "prompt": "Review branch $BRANCH against base $BASE_REF. This workflow routes results by named exits, not kanna_request_revision (which this task refuses for agent-origin calls). Record your verdict with kanna_complete_stage: status \"success\", your findings as the message, and an exit chosen by the nature of the blocking findings: \"revise\" for implementation defects, back to \"in progress\" as usual; \"replan\" when the approach itself is structurally wrong — the plan cannot produce a correct result however well it is executed — back to \"plan\", framed as what the revised plan must address. A pass is status \"success\" with no exit, which advances to pr once a person confirms it. Never call kanna_request_revision on this task.",
      "policy": { "transition": "manual" },
      "exits": { "revise": "in progress", "replan": "plan" }
    },
    {
      "name": "pr",
      "description": "Agent creates a GitHub PR and hands off to the merge master",
      "agent": "pr",
      "prompt": "Create a PR for the reviewed work on branch $BRANCH.",
      "policy": { "transition": "manual", "handoff": "merge" }
    }
  ]
}
