{
  "$schema": "./schema.json",
  "name": "designed",
  "description": "Use for front-loaded design: iterate a mockup with an agent, get stakeholders to agree on it and on the plan, then let agents implement, review, and open the PR. The front-loaded flow for work whose shape matters enough to see before anyone builds it. Not for work that is already obvious enough to just build (shaped, planned) or whose outcome is not yet chosen (research).",
  "routing": "exits",
  "stages": [
    {
      "name": "mockup",
      "description": "Agent builds an HTML mockup of the task and publishes it as an artifact",
      "agent": "mockup",
      "prompt": "$TASK_PROMPT",
      "policy": { "transition": "manual" }
    },
    {
      "name": "stakeholder",
      "description": "Gate with no role: stakeholders read the mockup in the artifact viewer and record their decision; approve advances to plan, and an operator sends the task back to mockup (kanna_request_revision, target \"mockup\") to iterate",
      "policy": { "transition": "manual" }
    },
    {
      "name": "plan",
      "description": "Planning agent turns the approved mockup into an implementation plan",
      "agent": "plan",
      "prompt": "$TASK_PROMPT\n\nIf the ledger context this session started from shows you were re-entered here through the review stage's \"replan\" exit, this is a revised-plan visit: record the revised plan as your result, and on that same kanna_complete_stage call also pass `expected_definition` (the workflowDefinition read from kanna_get_task) and `workflow_definition` (the identical document — the existing \"in progress\", \"review\", \"pr\" and \"pr-review\" stages kept byte for byte; a replan revises the plan, not the shape) so this task's remaining plan is formally replaced through the T1 remaining-plan replacement contract, and confirm `workflowExtended: true` in the response. On the workflow's first entry (not a replan), record the plan as usual with no `workflow_definition`.",
      "policy": { "transition": "auto" }
    },
    {
      "name": "in progress",
      "description": "Agent implements the approved plan; the transition commits its work",
      "agent": "implement",
      "prompt": "$TASK_PROMPT",
      "policy": { "transition": "auto", "loop_transition": "auto" },
      "exit_commit": true
    },
    {
      "name": "review",
      "description": "Review agent checks quality and coverage, choosing the revision target by the nature of the findings, before the human reads the verdict",
      "agent": "review",
      "prompt": "Review branch $BRANCH against base $BASE_REF. This workflow routes results by named exits, not kanna_request_revision (which this task refuses for agent-origin calls). Record your verdict with kanna_complete_stage: status \"success\", your findings as the message, and an exit chosen by the nature of the blocking findings: \"revise\" for implementation defects, back to \"in progress\" as usual; \"replan\" when the plan itself is structurally wrong, back to \"plan\". A pass is status \"success\" with no exit, which advances to pr once a person confirms it. Never call kanna_request_revision on this task.",
      "policy": { "transition": "manual" },
      "exits": { "revise": "in progress", "replan": "plan" }
    },
    {
      "name": "pr",
      "description": "Agent creates a GitHub PR",
      "agent": "pr",
      "prompt": "Create a PR for the reviewed work on branch $BRANCH.",
      "policy": { "transition": "manual" }
    },
    {
      "name": "pr-review",
      "description": "PR reviewer briefs the human on the pull request, then hands off to the merge master",
      "agent": "pr-reviewer",
      "prompt": "$TASK_PROMPT",
      "policy": { "transition": "manual", "handoff": "merge" }
    }
  ]
}
